title,company,location,description,url,email,phone,contact_person
(Junior) Key Account Manager - Remote (m/w/d),Pflegia,"Germany · 13 minutes ago · 0 applicants
Promoted by hirer · No response insights available yet","About the job
Deine Aufgaben bei uns

Beziehungen, die halten und wachsen! – Du bist nicht nur Ansprechpartner für Deine Partner, sondern auch ein Wachstumsgeber. Du sorgst dafür, dass die Zusammenarbeit langfristig erfolgreich bleibt, indem Du stets ein offenes Ohr für ihre Anliegen hast und ihre Recruitingprozesse kontinuierlich optimierst.

Mitgestaltung, die Sinn macht! – Du hast die Verantwortung, die Kandidatenfindung aktiv zu gestalten, vom ersten Match bis zur erfolgreichen Vermittlung. So trägst Du dazu bei, dass Dein Partnerunternehmen dauerhaft im Wettbewerb bestehen kann.

Match-Maker mit Mission! – Du unterstützt bei der Konditionsverhandlung zwischen Bewerbern und Arbeitgebern, um das beste Angebot für beide Seiten zu finden – und hilfst so, die Partnerschaft langfristig zu stärken.

Bestandskunden weiterentwickeln und Cross-Selling betreiben! – Du entwickelst bestehende Beziehungen aktiv weiter und erkennst Cross-Selling-Potenziale, damit Deine Partnerunternehmen auch langfristig von weiteren Services profitieren und ihre Recruitingprozesse weiter optimieren.

Strategische Partnerbetreuung – Du hilfst Deinen Partnerunternehmen, ihre Recruitingstrategien weiterzuentwickeln und die Profile sowie Stellenausschreibungen stets up-to-date zu halten, damit der Rekrutierungsprozess immer effizienter wird.

Effiziente Kommunikation – Du führst regelmäßige Feedback-Gespräche und entwickelst gemeinsam mit Deinen Partnern individuelle Lösungsansätze, um ihre Recruitingprozesse immer weiter zu optimieren und ihnen zu helfen, als Unternehmen zu wachsen.

Proaktive Problemlösung – Du erkennst Herausforderungen frühzeitig und entwickelst maßgeschneiderte Lösungen, die nicht nur für den Moment, sondern langfristig von Nutzen sind.

Analyse und Reporting – Du analysierst die Performance Deiner Key Accounts und schlägst basierend auf den gewonnenen Erkenntnissen optimierte Recruitingprozesse vor, die Deine Partner nachhaltig verbessern und wachsen lassen.

Zielorientierte Kandidatenvermittlung – Du sorgst dafür, dass unsere Partnerunternehmen die passenden Pflegekräfte gewinnen, und hilfst so, eine Win-Win-Situation zu schaffen, in der sowohl Deine Partner als auch die Pflegekräfte von einer langfristigen Zusammenarbeit profitieren.


Das bringst Du mit

Customer-First-Mentalität – Du stellst die Bedürfnisse der Kunden stets in den Vordergrund und gehst die Extrameile für eine positive Zusammenarbeit.

Kommunikationsstärke und Freude am Kundenkontakt – Du arbeitest gerne mit Menschen und gehst offen auf Kunden und Partner zu.

Organisationstalent und Zielorientierung – Du behältst den Überblick und arbeitest strukturiert, um Deine eigenen Ziele und die des Teams zu erreichen.

Lösungsorientierung und Kreativität – Du findest kreative Ansätze für neue Herausforderungen und setzt sie selbstständig um.

Lernbereitschaft und Weiterentwicklung – Du möchtest Deine Fähigkeiten kontinuierlich ausbauen und profitierst von unseren Coachings und Workshops.

Vertriebsaffinität und Cross-Selling-Talent – Du erkennst Potenziale für Cross-Selling und Erweiterungen und weißt, wie man zusätzliche Services anbietet.

Analytisches Denkvermögen – Du kannst Kundenbedürfnisse und Trends erkennen und nutzt diese Informationen, um individuelle Lösungen anzubieten.

Deutschkenntnisse auf C2-Niveau – da Du in Deiner Rolle auf Entscheider-Ebene mit unseren deutschsprachigen Partnern kommunizierst und verhandelst.


Das bieten wir Dir

Top ausgestattetes Office in Berlin – Ein modernes Büro mit zentraler Lage, erstklassiger Anbindung und inspirierender Arbeitsumgebung.

Attraktive Vergütung – Ein faires Grundgehalt plus ungedeckelte Provision, die Deinen Erfolg direkt belohnt.

Intensive Einarbeitung – Starte mit einem 8-wöchigen Onboarding in Berlin, um uns und unsere Arbeitsweise von Grund auf kennenzulernen.

Remote-Arbeit nach der Einarbeitung – Nach Deiner Einarbeitungszeit arbeitest Du bequem aus dem Homeoffice und besuchst uns alle 2 Monate für eine Woche in Berlin zu unseren Team- und Companyevents.

Übernahme aller Reisekosten – Wir übernehmen die Reise- und Übernachtungskosten für Deine Einarbeitungszeit und für die regelmäßigen Besuche in Berlin.

Unbegrenzte Entwicklungsmöglichkeiten – Zeig, was in Dir steckt! Bei uns gibt es keine Limitationen – ob Du Dich fachlich weiterentwickeln, mehr Verantwortung übernehmen oder eine Führungsposition anstreben möchtest: Deine Karriere ist das, was Du daraus machst! Wir wachsen schnell und bieten Dir die Möglichkeit, gemeinsam mit uns zu wachsen.

Moderne Arbeitsausstattung – Laptop, Bildschirm und Headset stehen Dir für ein produktives Arbeiten zur Verfügung.

Effiziente Tools und Systeme – Nutze Slack, Zoom und unser maßgeschneidertes CRM-System, um Deinen Arbeitsalltag effizient zu gestalten.

Regelmäßige Team- und Networking-Events – Von After-Work-Sessions über Fußball oder Volleyball bis zu Teambuilding-Aktivitäten und Firmenläufen.

Kostenlose Verpflegung – Frischer Kaffee, kühle Getränke, Snacks und Obst stehen Dir jederzeit zur Verfügung.

Personalisierte Snack-Bestellungen – Über unsere wöchentliche REWE-Bestellung kannst Du Deine Lieblingssnacks direkt ins Büro liefern lassen.

Friyay-Feeling – Jeden Freitag lassen wir die Woche gemeinsam mit Pizza und Bier im Büro ausklingen.

Haustierfreundliches Büro – Dein Hund ist bei uns herzlich willkommen.

27 Urlaubstage pro Jahr – Für ausreichend Erholung und eine ausgewogene Work-Life-Balance.
See less",https://www.linkedin.com/jobs/view/4259171720/?eBP=NON_CHARGEABLE_CHANNEL&refId=WTsAoRQcLRXywJ8lV9p3FQ%3D%3D&trackingId=pQNJ0OT2noM7k1I1p5AIGw%3D%3D&trk=flagship3_search_srp_jobs,,,für Deine Partner
(Junior) Customer Success Manager - Remote (m/w/d),Pflegia,"Germany · 13 minutes ago · 1 applicant
Promoted by hirer · No response insights available yet","About the job
Deine Aufgaben bei uns

Begleitung unserer Pflegehelden – Du bist die erste Ansprechperson für Pflegekräfte und begleitest sie engagiert und empathisch vom ersten Kontakt bis zur erfolgreichen Vermittlung.

Individuelle Betreuung mit Herz – Du nimmst die Wünsche und Bedürfnisse der Pflegekräfte auf und gestaltest ihren Bewerbungsprozess unkompliziert und reibungslos.

Passgenaue Stellenvermittlung – Du bringst Talente und Arbeitgeber zusammen, indem Du die Präferenzen der Pflegekräfte mit den besten Angeboten unserer Partnerunternehmen perfekt matchst.

Feedback, das zählt – Du sammelst aktiv Rückmeldungen von Pflegekräften, um unsere Prozesse noch besser zu machen und die Candidate Experience auf das nächste Level zu heben.

Teamwork, das Spaß macht – Gemeinsam mit dem Account Management entwickelst Du maßgeschneiderte Lösungen, um die Erwartungen unserer Kandidaten und Partnerunternehmen zu übertreffen.

Präzise Dokumentation – Du hältst alle wichtigen Informationen zu den Kandidaten stets up to date und stellst sicher, dass unsere Kennzahlen jederzeit verfügbar und präzise sind.
Mit Deiner Unterstützung schaffst Du ein echtes Win-Win für Pflegekräfte und Partnerunternehmen – und gestaltest aktiv die Zukunft der Gesundheitsbranche!


Das bringst Du mit

Kommunikationsstärke und Empathie – Du kannst komplexe Sachverhalte einfach erklären und gehst freundlich sowie lösungsorientiert auf Menschen zu.

Organisationsgeschick – Du bist strukturiert und behältst auch bei vielen parallel laufenden Aufgaben den Überblick.

Eigeninitiative und Lösungsorientierung – Du packst proaktiv an, erkennst Herausforderungen und entwickelst kreative Lösungen.

Teamfähigkeit – Du arbeitest gerne im Austausch mit anderen und trägst aktiv zu einer positiven Teamdynamik bei.

Digitale Affinität – Du fühlst Dich im Umgang mit Tools wie CRM-Systemen, Slack und Zoom wohl und lernst schnell neue Systeme kennen.

Motivation und Lernbereitschaft – Du möchtest Dich kontinuierlich weiterentwickeln und bist offen für Coachings und neue Herausforderungen.

Hands-on-Mentalität – Du setzt Ideen in die Tat um und arbeitest ergebnisorientiert.

Deutschkenntnisse auf C2-Niveau – da Du in Deiner Rolle auf Entscheider-Ebene mit unseren deutschsprachigen Kandidat:innen kommunizierst.


Das bieten wir Dir

Top ausgestattetes Office in Berlin – Ein modernes Büro mit zentraler Lage, erstklassiger Anbindung und inspirierender Arbeitsumgebung.

Attraktive Vergütung – Ein faires Grundgehalt plus ungedeckelte Provision, die Deinen Erfolg direkt belohnt.

Intensive Einarbeitung – Starte mit einem 8-wöchigen Onboarding in Berlin, um uns und unsere Arbeitsweise von Grund auf kennenzulernen.

Remote-Arbeit nach der Einarbeitung – Nach Deiner Einarbeitungszeit arbeitest Du bequem aus dem Homeoffice und besuchst uns einmal pro Quartal für eine Woche in Berlin zu unseren Team- und Companyevents.

Übernahme aller Reisekosten – Wir übernehmen die Reise- und Übernachtungskosten für Deine Einarbeitungszeit und für die regelmäßigen Besuche in Berlin.

Unbegrenzte Entwicklungsmöglichkeiten – Zeig, was in Dir steckt! Bei uns gibt es keine Limitationen – ob Du Dich fachlich weiterentwickeln, mehr Verantwortung übernehmen oder eine Führungsposition anstreben möchtest: Deine Karriere ist das, was Du daraus machst! Wir wachsen schnell und bieten Dir die Möglichkeit, gemeinsam mit uns zu wachsen.

Moderne Arbeitsausstattung – Laptop, Bildschirm und Headset stehen Dir für ein produktives Arbeiten zur Verfügung.

Effiziente Tools und Systeme – Nutze Slack, Zoom und unser maßgeschneidertes CRM-System, um Deinen Arbeitsalltag effizient zu gestalten.

Regelmäßige Team- und Networking-Events – Von After-Work-Sessions über Fußball oder Volleyball bis zu Teambuilding-Aktivitäten und Firmenläufen.

Kostenlose Verpflegung – Frischer Kaffee, kühle Getränke, Snacks und Obst stehen Dir jederzeit zur Verfügung.

Personalisierte Snack-Bestellungen – Über unsere wöchentliche REWE-Bestellung kannst Du Deine Lieblingssnacks direkt ins Büro liefern lassen.

Friyay-Feeling – Jeden Freitag lassen wir die Woche gemeinsam mit Pizza und Bier im Büro ausklingen.

Haustierfreundliches Büro – Dein Hund ist bei uns herzlich willkommen.

27 Urlaubstage pro Jahr – Für ausreichend Erholung und eine ausgewogene Work-Life-Balance.
See less",https://www.linkedin.com/jobs/view/4259176123/?eBP=NON_CHARGEABLE_CHANNEL&refId=WTsAoRQcLRXywJ8lV9p3FQ%3D%3D&trackingId=78xasWz6%2BDgm4VI7o1c0SQ%3D%3D&trk=flagship3_search_srp_jobs,,,bis zur erfolgreichen Vermittlung.
Junior Sales Manager (m/w/d),gestalten,"Germany · 34 minutes ago · 4 people clicked apply
Promoted by hirer · Responses managed off LinkedIn","About the job


Wir suchen

Du suchst nach einer spannenden Herausforderung im Vertrieb und hast ein Gespür für die Verlags- und Medienbranche? Perfekt!
Wir suchen eine/n engagierte/n Junior Sales Manager/in für unser US-Vertriebsteam. In dieser Rolle unterstützt du unsere Head of US Sales und gestaltest aktiv den Erfolg unserer illustrierten Bücher der Imprints gestalten, Little Gestalten und teNeues mit.

Deine Aufgaben & Verantwortlichkeiten


Professionelle und aktive Betreuung eines definierten Kundenstamms, sowie Steuerung und Steigerung von Umsatz und Marge 
Akquisition von neuen, potenziellen Kunden in bestehenden und alternativen Vertriebskanälen 
Recherche, Analyse und Entwicklung von Strategien und Forecast-Planungen für die jeweiligen Kanäle und Kunden 
Enger Austausch mit dem internen und Außen-Vertriebsteam zur optimalen Betreuung am POS 
Pflege der Kundendatenbank 
Auftragsmanagement
Organisation und Aufbereitung von Informationen für Händler und Verkaufsteams: Neuheiten, Auswertungen, Verkaufsunterlagen
Vorbereitung, Teilnahme und Nachbereitung von Messen und Konferenzen


Deine Fähigkeiten & Erfahrungen

Eine engagierte und erfolgsorientierte Persönlichkeit
Erfahrung im Bereich Key Account Management
Spaß beim Aufbau und in der Pflege von Kunden- und Geschäftsbeziehungen
Verständnis für Märkte und Marktentwicklungen
Engagierte und erfolgsorientierte Persönlichkeit
Leidenschaft für visuelle Produkte und kreative Lifestyle Themen
Interesse an unserem Verlagsprogramm, sowie ein gutes Gespür für unsere Zielgruppe
Gute analytische Fähigkeiten und ein sicheres Zahlenverständnis
Sehr gute Sprachkenntnisse in Englisch, Deutsch ist ein Plus


Unser Angebot

Zwei weltweit gefeierte Imprints voller inspirierender Themen und Publikationen, geschaffen mit einem Netzwerk aus Top-Partnern und kreativen Köpfen.
Ein dynamisches und lebendiges Sales-Team, das dich willkommen heißt.
Eine abwechslungsreiche Rolle mit viel Raum für deine eigenen Ideen und Initiative.
Ein internationales, offenes und leidenschaftliches Team, das gemeinsam Erfolge feiert.
Ein modernes IT-Umfeld, das dich optimal unterstützt.
Flexibilität pur: Arbeite remote, in unserem Büro in Berlin oder München – du hast die Wahl!
Attraktive Benefits wie Urban Sports oder ein Jobticket.


Über uns



Die Gestalten Verlag GmbH & Co. KG is an international publishing house that includes the imprints gestalten, teNeues, and Little Gestalten.



Since 1995 gestalten has been celebrated for its exceptional illustrated books. Our diverse content covers architecture, art and design, fashion and lifestyle, cuisine, travel, and adventure, with our mission being to inspire creative lives. We achieve this by collaborating with pioneers who ignite creativity, showcasing innovative projects, and exploring relevant topics. Our publications are not only visually stunning but also crafted with high-quality and sustainable practices. 



Since 2014, we have also included a dedicated children’s book segment - Little Gestalten - that captivates and inspires young readers.

teNeues is a distinguished international publisher specializing in high-end coffee table books on photography, design, fashion, travel, and lifestyle. Founded in Germany and rooted in a legacy of fine printing, teNeues has become synonymous with luxury publications and striking visual storytelling.

Our team of about 50 dedicated professionals manages every aspect of our publications, from initial concept through editorial development, editing, translation, design, layout, printing, marketing, and worldwide distribution.




If you are passionate about transforming creative ideas into successful products as part of a dynamic team, we invite you to apply! gestalten is committed to fostering a diverse environment. We welcome all applications - regardless of gender, nationality, ethnic and social origin, religion/worldview, disability, age, living situation, sexual orientation, and identity. All employment decisions are made based on qualifications, merit, and business need.

See less",https://www.linkedin.com/jobs/view/4259164982/?eBP=NON_CHARGEABLE_CHANNEL&refId=WTsAoRQcLRXywJ8lV9p3FQ%3D%3D&trackingId=04HZAMSdJNPu79Fg6897Jw%3D%3D&trk=flagship3_search_srp_jobs,,,
Junior Supply Chain Manager - Planning (w/m/d),LILLYDOO GmbH,"Germany · 1 hour ago · 6 people clicked apply
Responses managed off LinkedIn","About the job
Jobbeschreibung
ab sofort | Teilzeit (50%, 20h pro Woche) | befristet auf 18 Monate | remote in Deutschland oder in unserem Frankfurter Office 

Hallo! Wir sind LILLYDOO. Schön, Dich kennenzulernen!
Unsere Vision ist es Lovebrands für die Kategorien Babypflege und Inkontinenz zu etablieren. Unsere Marken LILLYDOO und Vivoy finden nicht nur über unsere eigene Webseite den Weg zu unseren Kund*innen, sondern zeigen auch immer mehr Präsenz auf anderen Onlinemarktplätzen und in der Drogerie. Gemeinsam wollen wir noch weiterwachsen. Dafür sind wir auf der Suche nach neuen Talenten für unser innovatives E-Commerce Unternehmen.

Lass uns gemeinsam durchstarten! 

DEINE MISSION ALS (JUNIOR) SUPPLY CHAIN MANAGER - PLANNING (W/M/D) BEI LILLYDOO

Bestandsplanung und -management und Verantwortung für daraus resultierende Produktverfügbarkeit

Proaktive Auswertung relevanter Bestandskennzahlen, um Performance zu steigern und Kosten sowie gebundenes Kapital zu reduzieren

Ganzheitliches, internationales Lieferantenmanagement

Unterstützung der Planung und Umsetzung von Supply Chain Management Projekten aus der Planungsperspektive wie z.B. Produkteinführungen, Markteinführungen oder Prozessoptimierungen

Entwicklung einer verlässlichen Absatzvorhersage basierend auf historischen Daten, statistischen Methoden, Verkaufstrends und Markteinblicken

Pflege und Verbesserung unserer Vorhersagetools

Kommunikation von Vorhersageentwicklungen und Ergebnissen


DAS BIETEN WIR DIR
Freizeit & Flexibilität:


30 Tage Urlaub

Flexibles Arbeiten - ganz wie es für dich am besten passt - Remote oder nach Wahl in unserem Büro in FFM

Beliebiges ""mobile working"" innerhalb Deutschlands

Vereinbare deine Reisewünsche mit einem spannenden Job bei uns: bis zu 70 Tage im Jahr ist es möglich aus dem Ausland zu arbeiten

Nutzung unserer ""LILLYDOO Flexible Working Offers"": Umfangreiche Auswahl aus Urlaubs- und Teilzeitmodellen

Flexible Arbeitszeiten

Team Events

Wohltätigkeits-Teaminitiativen


Persönliche Vorzüge:

Kostenloses Windel-Abo für Eltern

Monatlich 30€ Zuschuss für deine Internetnutzung

Corporate Benefits Account (attraktive Angebote und Rabatte für viele verschiedene Marken)

Zugang zur 360° Health & Wellbeing Plattform

Kostenloses Windel-Abo für Eltern

Family & Friends Rabatt

Betriebliche Altersvorsorge (20% Arbeitgeberanteil)

Unterstützung bei Visa- und Einbürgerungsverfahren

Nach der Probezeit (6 Monate): 

Monatlich 44€ auf deine persönliche




Darüberhinaus bieten wir Dir gerne ein Umfeld, in dem Du Deine Ideen in neue oder bestehende Prozesse und Projekte, einbringen kannst.

DAS ZEICHNET UNSER TEAM AUS

""Supply Chain Management ist die absolute Leidenschaft unseres motivierten und innovativen Teams. Mit Engagement und Spaß an der Arbeit sorgen wir jeden Tag dafür, die Erwartungen unserer Kunden zu übertreffen. Werde Teil des Teams und sei mit dafür verantwortlich, unsere Mission zu erfüllen, die heißt: delivering happiness!"" 

Sina aus dem Supply Chain Management

Stellenanforderungen
DEIN PROFIL


Du verfügst über einen sehr guten Studienabschluss der Wirtschaftswissenschaften, BWL, des Supply Chain Managements oder eines verwandten Studiengangs

Du liebst es, mit Zahlen zu arbeiten und Analysen durchzuführen

Zudem bringst Du sehr gute MS Office (insbesondere Excel) Kenntnisse mit

Während Deiner bisherigen Karriere konntest Du bereits Erfahrungen in der Umsetzung von Projekten sammeln

Sehr gute Englisch Sprachkenntnisse (C1/C2 Level); Englisch ist zudem unsere Team- und Firmensprache

Gute Deutsch Sprachkenntnisse (B1/B2 Level)


DAS WÄRE ZUSÄTZLICH SCHÖN

Erfahrung in der Planung einer Supply Chain oder in der Zusammenarbeit mit externen Partner*innen


MIT DIESEN BEGRIFFEN BIST DU VERTRAUT

#Asana #MicrosoftBusinessCentral #ERP

* Bei LILLYDOO rekrutieren wir PRO Diversität! Dabei befolgen wir uneingeschränkt die gesetzliche Verpflichtung durch das Allgemeine Gleichbehandlungsgesetz (AGG).
See less",https://www.linkedin.com/jobs/view/4257144420/?eBP=NON_CHARGEABLE_CHANNEL&refId=WTsAoRQcLRXywJ8lV9p3FQ%3D%3D&trackingId=hFyQT6mG4%2BzIOM5TD4cimQ%3D%3D&trk=flagship3_search_srp_jobs,,,
Trainee (m/w/x) Betriebsberatung / Business Consultant,TieTalent,"Langenhagen, Lower Saxony, Germany · 1 hour ago · 0 people clicked apply
Responses managed off LinkedIn","About the job
About

Über unsStrategie trifft Praxis – du willst verstehen, gestalten und mitwachsen? Dann starte bei expert als Trainee in der Betriebsberatung durch. Hier zählt nicht nur deine Analysefähigkeit – sondern vor allem dein Antrieb, gemeinsam etwas zu bewegen. In unserem 24-monatigen Programm lernst du, wie du betriebswirtschaftliche Themen greifbar machst, Prozesse optimierst und echten Mehrwert schaffst.Zur Verstärkung unseres Teams suchen wir dich als Trainee (m/w/x) Betriebsberatung / Business Consultant.AufgabenBegleitung und Unterstützung des Regionalleiter-Team bei der Beratung unserer FachhändlerAnalyse betriebswirtschaftlicher Kennzahlen sowie Erstellung kurzfristiger Erfolgsrechnungen (KER)Mitwirkung bei Standortanalysen, Expansionen und strategischen ProjektenAufbereitung und Auswertung von Marktforschungsdaten zur internen und externen NutzungUnterstützung im Wissenstransfer zwischen der expert Zentrale und unseren Gesellschafter:innenProfilEin abgeschlossenes betriebswirtschaftliches Studium – gern dual oder mit erster Praxiserfahrung.Idealerweise Erfahrungen im Handel durch Praktika/AusbildungDu denkst analytisch, kommunizierst klar und arbeitest strukturiertDu hast Lust auf eigenverantwortliches Arbeiten, Teamwork und bundesweite ReisetätigkeitSicherer Umgang mit MS Office – insbesondere PowerPoint & ExcelWir bietenUnser Versprechen an dich:Du arbeitest in einem Unternehmen, das Vertrauen, Echtheit und Zusammenhalt lebt.Eine offene Atmosphäre, in der Fehler Lernchancen sind und deine Ideen willkommen sind.Benefits, die dein Leben besser machen:Sicherheit: Unbefristeter Vertrag, 30 Tage Urlaub und ein 13. Gehalt (Urlaubs- und Weihnachtsgeld).Flexibilität: Mobile Arbeit, flexible Zeiten (07:00-20:00 Uhr) und ein Arbeitszeitkonto.Vorteile, die sich lohnen: Zuschuss zum Deutschlandticket, Mitarbeiterkonditionen, Rabatte und attraktive Leasingangebote für Fahrräder oder E-Bikes.Für deinen Alltag: Kostenlose Getränke (Kaffee, Tee, Wasser) und ein tolles Team.KontaktBewirb dich jetzt!Wir freuen uns auf deine Energie und deine Ideen! Bewirb dich über karriere.expert.de oder per Post an:expert Warenvertrieb GmbH Bayernstraße 4 30855 LangenhagenLass uns gemeinsam etwas bewegen!Bei Fragen ist für dich da:Verena Hemmert0511 7808 469Recruiting

Nice-to-have skills

Powerpoint
Langenhagen, Lower Saxony, Germany

Work experience

Business Analyst
Business Developer / Sales Development Representative

Languages

German
See less",https://www.linkedin.com/jobs/view/4260800960/?eBP=NON_CHARGEABLE_CHANNEL&refId=WTsAoRQcLRXywJ8lV9p3FQ%3D%3D&trackingId=F1unt%2BDxDEji6pjuhyYLGg%3D%3D&trk=flagship3_search_srp_jobs,,0511 7808 469,Bewirb dich jetzt
SAP Junior Consultant Finance (m/w/d),iCAS Consulting und Anwendungssysteme AG,"Rhineland-Palatinate, Germany · 2 hours ago · 6 applicants
No response insights available yet","About the job
Standort: Remote (Teilzeit/Vollzeit)

Dein Profil:
Erfolgreich abgeschlossenes Studium in BWL, Informatik oder Wirtschaftsinformatik
SAP FI-Kenntnisse (Muss-Kriterium) – SAP CO ist ein Plus
Erste Erfahrung (2–5 Jahre) mit ERP-Systemen, idealerweise im Bereich Finance (z. B. Inhouse-Consulting, öffentlicher Sektor, Haushalt & Finanzen)
Analytische Denkweise sowie gute Moderations- und Präsentationsfähigkeiten
Verständnis für betriebswirtschaftliche Prozesse, besonders im Finanzumfeld

Deine Rolle:
Starte deine Karriere als SAP Junior Consultant Finance und arbeite an der Seite unserer erfahrenen SAP-Expert:innen!
Du lernst, das volle Potenzial von SAP-Lösungen auszuschöpfen und unterstützt unsere Kunden bei der Optimierung ihrer Finanzprozesse.

Was bieten wir dir:
Arbeit mit einem aufgeschlossenen und dynamischen Team
Gemeinsame Firmenevents und ein 
gutes Betriebsklima
Leasing-Konditionen für Fahrräder und E-Bikes
Flexible Arbeitsmodelle (Remote)
Direktes Feedback, sodass du dich stets weiterentwickeln kannst
Individuelle Entwicklungsmöglichkeiten
See less",https://www.linkedin.com/jobs/view/4260804235/?eBP=NON_CHARGEABLE_CHANNEL&refId=WTsAoRQcLRXywJ8lV9p3FQ%3D%3D&trackingId=HuwVKFoFdhCMeN6jZqKnHA%3D%3D&trk=flagship3_search_srp_jobs,,,
