title,company,location,description,url,email,phone,contact_person
"(Junior) Softwareentwickler/in - Quereinsteiger/innen willkommen, 100% remote (m/w/d/)",Syntax Institut,"Flensburg, Schleswig-Holstein, Germany · 2 hours ago · 0 people clicked apply
Responses managed off LinkedIn","About the job
Syntax Institut

Das Syntax Institut ist ein AZAV-zertifizierter Bildungsträger, der sich auf die App- und Web-Entwicklung spezialisiert hat. In unseren praxisnahen Kursen vermitteln erfahrene Entwickler/innen alles, was du brauchst, um erfolgreich in der IT-Branche durchzustarten. Wir begleiten unsere Teilnehmenden individuell und mit großem Engagement auf ihrem Weg – stets mit dem Ziel, lebenslanges Lernen und berufliche Weiterentwicklung zu fördern.

Deine Aufgaben

Die Vielfalt der App und Web-Entwicklung reicht von der Konzeption und Gestaltung bis zur Programmierung und Veröffentlichung von Apps und Websites. Mit umfangreichem Know-how in der Softwareentwicklung prägen App- und Web-Entwickler/innen maßgeblich die digitale Zukunft.

Bist du bereit, diese spannende Rolle zu übernehmen und deine technische Leidenschaft in eine erfolgreiche Karriere umzuwandeln?

All das lernst du Schritt-für-Schritt in nur 12 Monaten mit der kostenlosen App- oder Web-Entwicklungsweiterbildung beim Syntax Institut: 

Grundlagen der Softwareprogrammierung sowie UX/UI Design und Product Design
Entwicklung von Android- und iOS-Apps mit Kotlin (App-Entwicklungskurs) oder
Entwicklung von Websites (Web-Entwicklungskurs)
Abschlussprojekte inkl. deinem eigenen App-oder Web-Portfolio
Intensives Bewerbungscoaching und Karrierevorbereitung

Dein Profil

Willst du deine berufliche Laufbahn in der IT vorantreiben und bist derzeit bei der Agentur für Arbeit oder dem Jobcenter arbeitssuchend gemeldet? Hast du Interesse an digitalen Themen und Softwareentwicklung? Egal, ob du als Quereinsteiger/in in die Welt der IT eintauchst oder nach einer Pause wieder durchstarten möchtest.

Wir suchen Quereinsteiger/innen mit Interesse an IT und Softwareentwicklung.
Empfänger/innen von ALG I / ALG II sind bei uns herzlich willkommen und werden unterstützt.
Auch Wiedereinsteiger/innen nach einer Auszeit, zum Beispiel durch Elternzeit, sind bei uns gut aufgehoben.
Ein grundlegendes technisches Verständnis wird vorausgesetzt. Du musst allerdings nicht programmieren können. Wir bringen dir alles bei. 
Ausreichende Deutschkenntnisse erforderlich (ideal B1-Niveau).

Deine Vorteile

Unsere Weiterbildung Präsentiert Dir Den Schlüssel Zu Einer Erfolgreichen Zukunft - Flexibel, Förderfähig Und Mit Exklusiven Vorteilen

100% kostenlos über einen Bildungsgutschein der Agentur für Arbeit oder des Jobcenters, der deutschen Rentenversicherung, oder des Berufsförderungsdienstes der Bundeswehr (BFD)
100% Remote
Gratis MacBook
Relevante IHK-Zertifikate und praxisnahe Projekterfahrung
Karrierecoaching: Unser Team unterstützt dich bei allen Belangen, damit du nach deiner Weiterbildung deinen Traumjob in der App- oder Web-Entwicklung beginnen kannst.
Mehr als 20.000 offene Stellen in Deutschland

Sei dabei uns starte deine erfolgreiche Karriere als App- oder Web-Entwickler/in mit dem Syntax Institut!
See less",https://www.linkedin.com/jobs/view/4260801514/?eBP=NON_CHARGEABLE_CHANNEL&refId=WTsAoRQcLRXywJ8lV9p3FQ%3D%3D&trackingId=JYvy0IL%2B7l2VQUtbCd9kAw%3D%3D&trk=flagship3_search_srp_jobs,,,
(Junior) Key Account Manager - Remote (m/w/d),Pflegia,"Germany · 15 minutes ago · 0 applicants
Promoted by hirer · No response insights available yet","About the job
Deine Aufgaben bei uns

Beziehungen, die halten und wachsen! – Du bist nicht nur Ansprechpartner für Deine Partner, sondern auch ein Wachstumsgeber. Du sorgst dafür, dass die Zusammenarbeit langfristig erfolgreich bleibt, indem Du stets ein offenes Ohr für ihre Anliegen hast und ihre Recruitingprozesse kontinuierlich optimierst.

Mitgestaltung, die Sinn macht! – Du hast die Verantwortung, die Kandidatenfindung aktiv zu gestalten, vom ersten Match bis zur erfolgreichen Vermittlung. So trägst Du dazu bei, dass Dein Partnerunternehmen dauerhaft im Wettbewerb bestehen kann.

Match-Maker mit Mission! – Du unterstützt bei der Konditionsverhandlung zwischen Bewerbern und Arbeitgebern, um das beste Angebot für beide Seiten zu finden – und hilfst so, die Partnerschaft langfristig zu stärken.

Bestandskunden weiterentwickeln und Cross-Selling betreiben! – Du entwickelst bestehende Beziehungen aktiv weiter und erkennst Cross-Selling-Potenziale, damit Deine Partnerunternehmen auch langfristig von weiteren Services profitieren und ihre Recruitingprozesse weiter optimieren.

Strategische Partnerbetreuung – Du hilfst Deinen Partnerunternehmen, ihre Recruitingstrategien weiterzuentwickeln und die Profile sowie Stellenausschreibungen stets up-to-date zu halten, damit der Rekrutierungsprozess immer effizienter wird.

Effiziente Kommunikation – Du führst regelmäßige Feedback-Gespräche und entwickelst gemeinsam mit Deinen Partnern individuelle Lösungsansätze, um ihre Recruitingprozesse immer weiter zu optimieren und ihnen zu helfen, als Unternehmen zu wachsen.

Proaktive Problemlösung – Du erkennst Herausforderungen frühzeitig und entwickelst maßgeschneiderte Lösungen, die nicht nur für den Moment, sondern langfristig von Nutzen sind.

Analyse und Reporting – Du analysierst die Performance Deiner Key Accounts und schlägst basierend auf den gewonnenen Erkenntnissen optimierte Recruitingprozesse vor, die Deine Partner nachhaltig verbessern und wachsen lassen.

Zielorientierte Kandidatenvermittlung – Du sorgst dafür, dass unsere Partnerunternehmen die passenden Pflegekräfte gewinnen, und hilfst so, eine Win-Win-Situation zu schaffen, in der sowohl Deine Partner als auch die Pflegekräfte von einer langfristigen Zusammenarbeit profitieren.


Das bringst Du mit

Customer-First-Mentalität – Du stellst die Bedürfnisse der Kunden stets in den Vordergrund und gehst die Extrameile für eine positive Zusammenarbeit.

Kommunikationsstärke und Freude am Kundenkontakt – Du arbeitest gerne mit Menschen und gehst offen auf Kunden und Partner zu.

Organisationstalent und Zielorientierung – Du behältst den Überblick und arbeitest strukturiert, um Deine eigenen Ziele und die des Teams zu erreichen.

Lösungsorientierung und Kreativität – Du findest kreative Ansätze für neue Herausforderungen und setzt sie selbstständig um.

Lernbereitschaft und Weiterentwicklung – Du möchtest Deine Fähigkeiten kontinuierlich ausbauen und profitierst von unseren Coachings und Workshops.

Vertriebsaffinität und Cross-Selling-Talent – Du erkennst Potenziale für Cross-Selling und Erweiterungen und weißt, wie man zusätzliche Services anbietet.

Analytisches Denkvermögen – Du kannst Kundenbedürfnisse und Trends erkennen und nutzt diese Informationen, um individuelle Lösungen anzubieten.

Deutschkenntnisse auf C2-Niveau – da Du in Deiner Rolle auf Entscheider-Ebene mit unseren deutschsprachigen Partnern kommunizierst und verhandelst.


Das bieten wir Dir

Top ausgestattetes Office in Berlin – Ein modernes Büro mit zentraler Lage, erstklassiger Anbindung und inspirierender Arbeitsumgebung.

Attraktive Vergütung – Ein faires Grundgehalt plus ungedeckelte Provision, die Deinen Erfolg direkt belohnt.

Intensive Einarbeitung – Starte mit einem 8-wöchigen Onboarding in Berlin, um uns und unsere Arbeitsweise von Grund auf kennenzulernen.

Remote-Arbeit nach der Einarbeitung – Nach Deiner Einarbeitungszeit arbeitest Du bequem aus dem Homeoffice und besuchst uns alle 2 Monate für eine Woche in Berlin zu unseren Team- und Companyevents.

Übernahme aller Reisekosten – Wir übernehmen die Reise- und Übernachtungskosten für Deine Einarbeitungszeit und für die regelmäßigen Besuche in Berlin.

Unbegrenzte Entwicklungsmöglichkeiten – Zeig, was in Dir steckt! Bei uns gibt es keine Limitationen – ob Du Dich fachlich weiterentwickeln, mehr Verantwortung übernehmen oder eine Führungsposition anstreben möchtest: Deine Karriere ist das, was Du daraus machst! Wir wachsen schnell und bieten Dir die Möglichkeit, gemeinsam mit uns zu wachsen.

Moderne Arbeitsausstattung – Laptop, Bildschirm und Headset stehen Dir für ein produktives Arbeiten zur Verfügung.

Effiziente Tools und Systeme – Nutze Slack, Zoom und unser maßgeschneidertes CRM-System, um Deinen Arbeitsalltag effizient zu gestalten.

Regelmäßige Team- und Networking-Events – Von After-Work-Sessions über Fußball oder Volleyball bis zu Teambuilding-Aktivitäten und Firmenläufen.

Kostenlose Verpflegung – Frischer Kaffee, kühle Getränke, Snacks und Obst stehen Dir jederzeit zur Verfügung.

Personalisierte Snack-Bestellungen – Über unsere wöchentliche REWE-Bestellung kannst Du Deine Lieblingssnacks direkt ins Büro liefern lassen.

Friyay-Feeling – Jeden Freitag lassen wir die Woche gemeinsam mit Pizza und Bier im Büro ausklingen.

Haustierfreundliches Büro – Dein Hund ist bei uns herzlich willkommen.

27 Urlaubstage pro Jahr – Für ausreichend Erholung und eine ausgewogene Work-Life-Balance.
See less",https://www.linkedin.com/jobs/view/4259171720/?alternateChannel=search&eBP=NON_CHARGEABLE_CHANNEL&refId=WTsAoRQcLRXywJ8lV9p3FQ%3D%3D&trackingId=pQNJ0OT2noM7k1I1p5AIGw%3D%3D&trk=d_flagship3_search_srp_jobs,,,für Deine Partner
(Junior) Key Account Manager - Remote (m/w/d),Pflegia,"Germany · 15 minutes ago · 0 applicants
Promoted by hirer · No response insights available yet","About the job
Deine Aufgaben bei uns

Beziehungen, die halten und wachsen! – Du bist nicht nur Ansprechpartner für Deine Partner, sondern auch ein Wachstumsgeber. Du sorgst dafür, dass die Zusammenarbeit langfristig erfolgreich bleibt, indem Du stets ein offenes Ohr für ihre Anliegen hast und ihre Recruitingprozesse kontinuierlich optimierst.

Mitgestaltung, die Sinn macht! – Du hast die Verantwortung, die Kandidatenfindung aktiv zu gestalten, vom ersten Match bis zur erfolgreichen Vermittlung. So trägst Du dazu bei, dass Dein Partnerunternehmen dauerhaft im Wettbewerb bestehen kann.

Match-Maker mit Mission! – Du unterstützt bei der Konditionsverhandlung zwischen Bewerbern und Arbeitgebern, um das beste Angebot für beide Seiten zu finden – und hilfst so, die Partnerschaft langfristig zu stärken.

Bestandskunden weiterentwickeln und Cross-Selling betreiben! – Du entwickelst bestehende Beziehungen aktiv weiter und erkennst Cross-Selling-Potenziale, damit Deine Partnerunternehmen auch langfristig von weiteren Services profitieren und ihre Recruitingprozesse weiter optimieren.

Strategische Partnerbetreuung – Du hilfst Deinen Partnerunternehmen, ihre Recruitingstrategien weiterzuentwickeln und die Profile sowie Stellenausschreibungen stets up-to-date zu halten, damit der Rekrutierungsprozess immer effizienter wird.

Effiziente Kommunikation – Du führst regelmäßige Feedback-Gespräche und entwickelst gemeinsam mit Deinen Partnern individuelle Lösungsansätze, um ihre Recruitingprozesse immer weiter zu optimieren und ihnen zu helfen, als Unternehmen zu wachsen.

Proaktive Problemlösung – Du erkennst Herausforderungen frühzeitig und entwickelst maßgeschneiderte Lösungen, die nicht nur für den Moment, sondern langfristig von Nutzen sind.

Analyse und Reporting – Du analysierst die Performance Deiner Key Accounts und schlägst basierend auf den gewonnenen Erkenntnissen optimierte Recruitingprozesse vor, die Deine Partner nachhaltig verbessern und wachsen lassen.

Zielorientierte Kandidatenvermittlung – Du sorgst dafür, dass unsere Partnerunternehmen die passenden Pflegekräfte gewinnen, und hilfst so, eine Win-Win-Situation zu schaffen, in der sowohl Deine Partner als auch die Pflegekräfte von einer langfristigen Zusammenarbeit profitieren.


Das bringst Du mit

Customer-First-Mentalität – Du stellst die Bedürfnisse der Kunden stets in den Vordergrund und gehst die Extrameile für eine positive Zusammenarbeit.

Kommunikationsstärke und Freude am Kundenkontakt – Du arbeitest gerne mit Menschen und gehst offen auf Kunden und Partner zu.

Organisationstalent und Zielorientierung – Du behältst den Überblick und arbeitest strukturiert, um Deine eigenen Ziele und die des Teams zu erreichen.

Lösungsorientierung und Kreativität – Du findest kreative Ansätze für neue Herausforderungen und setzt sie selbstständig um.

Lernbereitschaft und Weiterentwicklung – Du möchtest Deine Fähigkeiten kontinuierlich ausbauen und profitierst von unseren Coachings und Workshops.

Vertriebsaffinität und Cross-Selling-Talent – Du erkennst Potenziale für Cross-Selling und Erweiterungen und weißt, wie man zusätzliche Services anbietet.

Analytisches Denkvermögen – Du kannst Kundenbedürfnisse und Trends erkennen und nutzt diese Informationen, um individuelle Lösungen anzubieten.

Deutschkenntnisse auf C2-Niveau – da Du in Deiner Rolle auf Entscheider-Ebene mit unseren deutschsprachigen Partnern kommunizierst und verhandelst.


Das bieten wir Dir

Top ausgestattetes Office in Berlin – Ein modernes Büro mit zentraler Lage, erstklassiger Anbindung und inspirierender Arbeitsumgebung.

Attraktive Vergütung – Ein faires Grundgehalt plus ungedeckelte Provision, die Deinen Erfolg direkt belohnt.

Intensive Einarbeitung – Starte mit einem 8-wöchigen Onboarding in Berlin, um uns und unsere Arbeitsweise von Grund auf kennenzulernen.

Remote-Arbeit nach der Einarbeitung – Nach Deiner Einarbeitungszeit arbeitest Du bequem aus dem Homeoffice und besuchst uns alle 2 Monate für eine Woche in Berlin zu unseren Team- und Companyevents.

Übernahme aller Reisekosten – Wir übernehmen die Reise- und Übernachtungskosten für Deine Einarbeitungszeit und für die regelmäßigen Besuche in Berlin.

Unbegrenzte Entwicklungsmöglichkeiten – Zeig, was in Dir steckt! Bei uns gibt es keine Limitationen – ob Du Dich fachlich weiterentwickeln, mehr Verantwortung übernehmen oder eine Führungsposition anstreben möchtest: Deine Karriere ist das, was Du daraus machst! Wir wachsen schnell und bieten Dir die Möglichkeit, gemeinsam mit uns zu wachsen.

Moderne Arbeitsausstattung – Laptop, Bildschirm und Headset stehen Dir für ein produktives Arbeiten zur Verfügung.

Effiziente Tools und Systeme – Nutze Slack, Zoom und unser maßgeschneidertes CRM-System, um Deinen Arbeitsalltag effizient zu gestalten.

Regelmäßige Team- und Networking-Events – Von After-Work-Sessions über Fußball oder Volleyball bis zu Teambuilding-Aktivitäten und Firmenläufen.

Kostenlose Verpflegung – Frischer Kaffee, kühle Getränke, Snacks und Obst stehen Dir jederzeit zur Verfügung.

Personalisierte Snack-Bestellungen – Über unsere wöchentliche REWE-Bestellung kannst Du Deine Lieblingssnacks direkt ins Büro liefern lassen.

Friyay-Feeling – Jeden Freitag lassen wir die Woche gemeinsam mit Pizza und Bier im Büro ausklingen.

Haustierfreundliches Büro – Dein Hund ist bei uns herzlich willkommen.

27 Urlaubstage pro Jahr – Für ausreichend Erholung und eine ausgewogene Work-Life-Balance.
See less",https://www.linkedin.com/jobs/view/4259171720/?alternateChannel=search&refId=WTsAoRQcLRXywJ8lV9p3FQ%3D%3D&trackingId=pQNJ0OT2noM7k1I1p5AIGw%3D%3D&trk=d_flagship3_search_srp_jobs,,,für Deine Partner
